{
  "$schema": "https://json-schema.org/draft/2020-12/schema",
  "$id": "https://blackcat.darkmesh/schemas/block.variant.v0.1.schema.json",
  "title": "BlackCat Block Variant v0.1",
  "type": "object",
  "required": ["schema", "blockId", "variantId", "version", "extends", "style", "tokens", "templateOverrides"],
  "properties": {
    "schema": { "const": "blackcat.block.variant.v0.1" },
    "blockId": { "type": "string", "minLength": 1 },
    "variantId": { "type": "string", "minLength": 1 },
    "version": { "type": "string", "minLength": 1 },
    "extends": { "type": "string", "minLength": 1 },
    "style": { "type": "string", "minLength": 1 },
    "tokens": { "type": "string", "minLength": 1 },
    "templateOverrides": {
      "type": "object",
      "propertyNames": { "type": "string", "minLength": 1 },
      "additionalProperties": { "type": "string", "minLength": 1 }
    }
  },
  "additionalProperties": false
}
